{
  "authority_granted": false,
  "can_call_connector": false,
  "can_claim_terminal_closure": false,
  "can_execute": false,
  "can_mutate": false,
  "evidence_accepted": false,
  "evidence_submitted": false,
  "live_connector_send_enabled": false,
  "live_execution_enabled": false,
  "mode": "foundation",
  "next_action": "Submit separate governed evidence packets for queued slots; this queue does not accept them.",
  "promotion_approved": false,
  "queue_id": "component_evidence_request_queue.foundation.v1",
  "queue_is_not_authority_grant": true,
  "queue_is_not_evidence_acceptance": true,
  "queue_is_not_evidence_submission": true,
  "queue_is_not_execution_authority": true,
  "queue_is_not_promotion_approval": true,
  "queue_is_not_terminal_closure": true,
  "request_slots": [
    {
      "authority_granted": false,
      "blocked_actions": [
        "calendar_write",
        "connector_call",
        "external_send",
        "mailbox_mutation",
        "memory_topology_activation",
        "send_email",
        "terminal_closure",
        "autonomous_execution",
        "customer_exposure",
        "deploy",
        "dns_mutation",
        "filesystem_write",
        "live_dispatch",
        "public_readiness_claim",
        "runtime_mutation",
        "secret_mutation",
        "account_binding_claim",
        "provider_write",
        "route_execution"
      ],
      "bundle_id": "personal_assistant_v0",
      "claim_firewall_blocking_claim_ids": [
        "blocked.production_ready",
        "blocked.customer_ready",
        "blocked.live_gmail_enabled",
        "blocked.autonomous_execution",
        "blocked.compliance_certified",
        "blocked.enterprise_sla",
        "blocked.nested_mind_live"
      ],
      "evidence_accepted": false,
      "evidence_submitted": false,
      "missing_evidence_ref": "gmail_account_binding_evidence_receipt",
      "operator_input_required": true,
      "outcome": "AwaitingEvidence",
      "promotion_approved": false,
      "proof_state": "Unknown",
      "request_id": "component_evidence_request_queue.personal_assistant_v0.gmail_account_binding_evidence_receipt.v1",
      "request_only": true,
      "request_state": "requested_not_submitted",
      "required_validator_refs": [
        "component_bundle_compiler_validator",
        "component_claim_firewall_validator",
        "component_evidence_request_queue_validator"
      ],
      "requirement_satisfied": false,
      "source_compilation_id": "component_bundle_compilation.personal_assistant_v0.v1",
      "source_outcome": "GovernanceBlocked",
      "terminal_closure_allowed": false
    },
    {
      "authority_granted": false,
      "blocked_actions": [
        "calendar_write",
        "connector_call",
        "external_send",
        "mailbox_mutation",
        "memory_topology_activation",
        "send_email",
        "terminal_closure",
        "autonomous_execution",
        "customer_exposure",
        "deploy",
        "dns_mutation",
        "filesystem_write",
        "live_dispatch",
        "public_readiness_claim",
        "runtime_mutation",
        "secret_mutation",
        "account_binding_claim",
        "provider_write",
        "route_execution"
      ],
      "bundle_id": "personal_assistant_v0",
      "claim_firewall_blocking_claim_ids": [
        "blocked.production_ready",
        "blocked.customer_ready",
        "blocked.live_gmail_enabled",
        "blocked.autonomous_execution",
        "blocked.compliance_certified",
        "blocked.enterprise_sla",
        "blocked.nested_mind_live"
      ],
      "evidence_accepted": false,
      "evidence_submitted": false,
      "missing_evidence_ref": "explicit_operator_send_approval_receipt",
      "operator_input_required": true,
      "outcome": "AwaitingEvidence",
      "promotion_approved": false,
      "proof_state": "Unknown",
      "request_id": "component_evidence_request_queue.personal_assistant_v0.explicit_operator_send_approval_receipt.v1",
      "request_only": true,
      "request_state": "requested_not_submitted",
      "required_validator_refs": [
        "component_bundle_compiler_validator",
        "component_claim_firewall_validator",
        "component_evidence_request_queue_validator"
      ],
      "requirement_satisfied": false,
      "source_compilation_id": "component_bundle_compilation.personal_assistant_v0.v1",
      "source_outcome": "GovernanceBlocked",
      "terminal_closure_allowed": false
    },
    {
      "authority_granted": false,
      "blocked_actions": [
        "calendar_write",
        "connector_call",
        "external_send",
        "mailbox_mutation",
        "memory_topology_activation",
        "send_email",
        "terminal_closure",
        "autonomous_execution",
        "customer_exposure",
        "deploy",
        "dns_mutation",
        "filesystem_write",
        "live_dispatch",
        "public_readiness_claim",
        "runtime_mutation",
        "secret_mutation",
        "account_binding_claim",
        "provider_write",
        "route_execution"
      ],
      "bundle_id": "personal_assistant_v0",
      "claim_firewall_blocking_claim_ids": [
        "blocked.production_ready",
        "blocked.customer_ready",
        "blocked.live_gmail_enabled",
        "blocked.autonomous_execution",
        "blocked.compliance_certified",
        "blocked.enterprise_sla",
        "blocked.nested_mind_live"
      ],
      "evidence_accepted": false,
      "evidence_submitted": false,
      "missing_evidence_ref": "live_send_authority_transition_receipt",
      "operator_input_required": true,
      "outcome": "AwaitingEvidence",
      "promotion_approved": false,
      "proof_state": "Unknown",
      "request_id": "component_evidence_request_queue.personal_assistant_v0.live_send_authority_transition_receipt.v1",
      "request_only": true,
      "request_state": "requested_not_submitted",
      "required_validator_refs": [
        "component_bundle_compiler_validator",
        "component_claim_firewall_validator",
        "component_evidence_request_queue_validator"
      ],
      "requirement_satisfied": false,
      "source_compilation_id": "component_bundle_compilation.personal_assistant_v0.v1",
      "source_outcome": "GovernanceBlocked",
      "terminal_closure_allowed": false
    },
    {
      "authority_granted": false,
      "blocked_actions": [
        "calendar_write",
        "connector_call",
        "external_send",
        "mailbox_mutation",
        "memory_topology_activation",
        "send_email",
        "terminal_closure",
        "autonomous_execution",
        "customer_exposure",
        "deploy",
        "dns_mutation",
        "filesystem_write",
        "live_dispatch",
        "public_readiness_claim",
        "runtime_mutation",
        "secret_mutation",
        "account_binding_claim",
        "provider_write",
        "route_execution"
      ],
      "bundle_id": "personal_assistant_v0",
      "claim_firewall_blocking_claim_ids": [
        "blocked.production_ready",
        "blocked.customer_ready",
        "blocked.live_gmail_enabled",
        "blocked.autonomous_execution",
        "blocked.compliance_certified",
        "blocked.enterprise_sla",
        "blocked.nested_mind_live"
      ],
      "evidence_accepted": false,
      "evidence_submitted": false,
      "missing_evidence_ref": "component_request_simulation_receipt",
      "operator_input_required": true,
      "outcome": "AwaitingEvidence",
      "promotion_approved": false,
      "proof_state": "Unknown",
      "request_id": "component_evidence_request_queue.personal_assistant_v0.component_request_simulation_receipt.v1",
      "request_only": true,
      "request_state": "requested_not_submitted",
      "required_validator_refs": [
        "component_bundle_compiler_validator",
        "component_claim_firewall_validator",
        "component_evidence_request_queue_validator"
      ],
      "requirement_satisfied": false,
      "source_compilation_id": "component_bundle_compilation.personal_assistant_v0.v1",
      "source_outcome": "GovernanceBlocked",
      "terminal_closure_allowed": false
    },
    {
      "authority_granted": false,
      "blocked_actions": [
        "connector_call",
        "external_send",
        "filesystem_write",
        "live_dispatch",
        "route_execution",
        "runtime_mutation",
        "terminal_closure",
        "autonomous_execution",
        "customer_exposure",
        "deploy",
        "dns_mutation",
        "public_readiness_claim",
        "secret_mutation"
      ],
      "bundle_id": "symbolic_reasoning_read_only",
      "claim_firewall_blocking_claim_ids": [
        "blocked.production_ready",
        "blocked.customer_ready",
        "blocked.live_gmail_enabled",
        "blocked.autonomous_execution",
        "blocked.compliance_certified",
        "blocked.enterprise_sla",
        "blocked.nested_mind_live"
      ],
      "evidence_accepted": false,
      "evidence_submitted": false,
      "missing_evidence_ref": "component_request_simulation_receipt",
      "operator_input_required": true,
      "outcome": "AwaitingEvidence",
      "promotion_approved": false,
      "proof_state": "Unknown",
      "request_id": "component_evidence_request_queue.symbolic_reasoning_read_only.component_request_simulation_receipt.v1",
      "request_only": true,
      "request_state": "requested_not_submitted",
      "required_validator_refs": [
        "component_bundle_compiler_validator",
        "component_claim_firewall_validator",
        "component_evidence_request_queue_validator"
      ],
      "requirement_satisfied": false,
      "source_compilation_id": "component_bundle_compilation.symbolic_reasoning_read_only.v1",
      "source_outcome": "SolvedUnverified",
      "terminal_closure_allowed": false
    },
    {
      "authority_granted": false,
      "blocked_actions": [
        "autonomous_execution",
        "connector_call",